<?xml version="1.0" encoding="UTF-8"?>
<Target xmlns:xsi="http://www.w3.org/2001/XMLSchema-instance"
 xsi:noNamespaceSchemaLocation="nestedEgd-target.xsd">
    <cities>
        <city>
            <name>Seattle</name>
            <companyset>
                <company>
                    <cId>N_1</cId>
                    <name>SJSU</name>
                </company>
                <company>
                    <cId>N_2</cId>
                    <name>IBM</name>
                </company>
            </companyset>
        </city>
        <city>
            <name>Cupertino</name>
            <companyset>
                <company>
                    <cId>N_3</cId>
                    <name>Apple</name>
                </company>
            </companyset>
        </city>
    </cities>
    <personset>
        <person>
            <ssn>1</ssn>
            <name>Alice</name>
            <salary>1000</salary>
            <address>NULL</address>
            <companyId>N_1</companyId>
            <hobbyset>
                <hobby>
                    <description>Music</description>
                </hobby>
            </hobbyset>
        </person>
        <person>
            <ssn>2</ssn>
            <name>John</name>
            <salary>1500</salary>
            <address>NULL</address>
            <companyId>N_2</companyId>
            <hobbyset/>
        </person>
        <person>
            <ssn>3</ssn>
            <name>Mark</name>
            <salary>2000</salary>
            <address>NULL</address>
            <companyId>N_1</companyId>
            <hobbyset>
                <hobby>
                    <description>Soccer</description>
                </hobby>
            </hobbyset>
        </person>
        <person>
            <ssn>4</ssn>
            <name>Steve</name>
            <salary>10000</salary>
            <address>NULL</address>
            <companyId>N_3</companyId>
            <hobbyset/>
        </person>
        <person>
            <ssn>5</ssn>
            <name>Jack</name>
            <salary>NULL</salary>
            <address>NULL</address>
            <companyId>NULL</companyId>
            <hobbyset>
                <hobby>
                    <description>Rugby</description>
                </hobby>
                <hobby>
                    <description>Dance</description>
                </hobby>
            </hobbyset>
        </person>
    </personset>
</Target>
